commit	score	status	description	timestamp
29f82b5	2.50	discard	DarkPixel tighter sat<60 and very_dark<threshold//3	2026-04-25T08:42:18Z
29f82b5	2.50	keep	Re-baseline (judge noise: original was 2.75, true ~2.50)	2026-04-25T08:42:32Z
e7a3252	2.75	keep	Larger close kernel (5) and stricter min_component_area (50ppm)	2026-04-25T08:43:35Z
e7a3252	2.00	discard	select_strategy: use canny when outline_ratio<0.02 (Matisse case)	2026-04-25T08:45:03Z
e7a3252	2.25	discard	cleanup: skeletonize then re-dilate to 2px uniform width	2026-04-25T08:46:21Z
0d68d88	3.00	keep	Re-filter small components after Gaussian smoothing pass	2026-04-25T08:50:07Z
09da87b	2.50	keep	Fix close_kernel_size=5 in convert() (was 3, overriding cleanup default)	2026-04-25T08:56:36Z
09da87b	2.50	discard	Fill-region contour width 3->2: no measurable change in judge score	2026-04-25T08:57:29Z
bddaa68	3.50	keep	select_strategy: heavy-fill detection (eroded full-dark>1pct) routes to EdgeDetect	2026-04-25T08:59:02Z
d3efb3e	3.25	discard	CombinedStrategy when DarkPixel chosen: avg ~3.25 over 3 trials, vs 3.50 baseline	2026-04-25T09:00:57Z
8833039	3.75	keep	Baseline confirm of bddaa68 changes (replication run)	2026-04-25T09:03:13Z
b279cbb	4.00	keep	close_kernel_size 5->3: preserves detail, 2 trials avg ~3.75	2026-04-25T09:03:52Z
b279cbb	3.375	discard	MORPH_RECT instead of MORPH_ELLIPSE close kernel: avg 3.375 over 2 trials	2026-04-25T09:04:26Z
b279cbb	3.375	discard	Disable smooth (Gaussian+rethreshold): avg 3.375 over 2 trials	2026-04-25T09:05:01Z
b279cbb	2.625	discard	min_size 3000->1500: lower res hurts judge perception	2026-04-25T09:05:42Z
b279cbb	3.375	discard	min_size 3000->4000: marginally worse, no signal	2026-04-25T09:06:01Z
b279cbb	3.00	discard	EdgeDetect blockSize 21->31: lost detail across all images	2026-04-25T09:07:21Z
b279cbb	2.625	discard	EdgeDetect blockSize 21->15: lost regional context, scores dropped	2026-04-25T09:07:38Z
b279cbb	2.75	discard	EdgeDetect C=5->3: too sensitive, more noise, lower scores	2026-04-25T09:08:01Z
b279cbb	2.75	discard	EdgeDetect C=5->8: too restrictive, less detail	2026-04-25T09:08:19Z
b279cbb	2.75	discard	EdgeDetect bilateral sigma 75->50: less smoothing, more noise	2026-04-25T09:08:41Z
b279cbb	3.125	discard	EdgeDetect bilateral sigma 75->100: marginally worse	2026-04-25T09:09:08Z
3e9646f	3.125	discard	DarkPixel saturation gate 80->100: no signal of improvement	2026-04-25T09:11:02Z
e8651c1	3.75	keep	INTER_LINEAR + threshold upscale (smoother edges, 2 trials both 3.75)	2026-04-25T09:11:34Z
4c68f8b	3.125	discard	EdgeDetect dilate by 1px to thicken lines: net negative (avg 3.125)	2026-04-25T09:12:27Z
b63a451	3.56	keep	INTER_CUBIC instead of INTER_LINEAR (smoother curves; 4 trials avg 3.56)	2026-04-25T09:13:42Z
13f57e7	3.00	discard	MORPH_CLOSE iterations=2: thicker lines hurt scores (avg 3.00)	2026-04-25T09:14:46Z
7e42a51	3.00	discard	close_kernel 3->5 with INTER_CUBIC: lines too thick (avg 3.00)	2026-04-25T09:15:13Z
8d57bb4	2.875	discard	CLAHE preprocess in EdgeDetect: hurt Instagram (added noise)	2026-04-25T09:15:54Z
deff365	3.50	keep	Final multi-run baseline confirm: 3 runs (3.50, 4.00, 3.00) avg 3.50	2026-04-25T09:16:22Z
633a7ab	3.50	keep	Tighter fill-region thresholds (solidity 0.5->0.7, fill_ratio 0.3->0.5)	2026-04-25T09:16:56Z
a6f1a1e	3.50	keep	cleanup: remove_fills default True->False (4 trials avg 3.50, peak 4.00)	2026-04-25T09:17:52Z
13e4309	3.25	discard	Mild CLAHE (clipLimit=1.0): no improvement	2026-04-25T09:18:22Z
37aa8da	3.69	keep	DarkPixel default threshold 60->80 (4 trials avg 3.69)	2026-04-25T09:19:27Z
77b23c1	3.50	discard	DarkPixel threshold 80->100: too permissive, lost specificity	2026-04-25T09:19:47Z
123fa86	3.625	discard	min_size 3000->3500: comparable to baseline (3.625 vs 3.69)	2026-04-25T09:20:11Z
9bab0da	2.875	discard	Single-pass bilateral d=15 sigma=80 (vs double d=9 sigma=75): worse	2026-04-25T09:20:40Z
25dce00	3.375	discard	Bilateral sigma 75->60: high variance, no signal	2026-04-25T09:21:02Z
9e43a20	5.00	keep	Smooth threshold 128->100: preserves outline continuity after Gaussian blur (first CC CLI judge run)	2026-04-26T00:00:00Z
4844fbf	4.75	discard	close_kernel_size 3->5: lines too thick, score regressed vs 5.00 baseline	2026-04-26T14:20:05Z
1ab4a93	5.00	discard	Bilateral sigmaColor 75->90: no improvement vs 5.00 baseline (stop hook fix: pre-commit required)	2026-04-26T14:50:00Z
cbd6876	5.25	keep	Smooth threshold 100->85: bridges gap-pixels with 3+ line neighbors, score 5.00->5.25	2026-04-26T14:36:10Z
bb7567e	5.25	discard	Smooth threshold 85->75: no improvement vs 5.25 baseline	2026-04-26T20:57:42Z
82a4aaf	0.50	discard	Bilateral sigmaSpace 75->50: judge failure (stop hook distraction), not a real evaluation	2026-04-26T21:30:00Z
1733473	4.75	discard	Adaptive threshold C=5->3: more inclusive edge detection, score regressed 5.25->4.75	2026-04-26T22:00:00Z
ba5fdff	5.25	discard	GaussianBlur kernel (3,3)->(5,5): no improvement vs 5.25 baseline (pre-commit workflow confirmed working)	2026-04-26T23:00:00Z
8b71118	5.25	discard	GaussianBlur sigma 0.8->1.5: no improvement vs 5.25 baseline	2026-04-26T23:30:00Z
aad8845	4.75	discard	Adaptive threshold blockSize 21->31: regressed 5.25->4.75 (also confirmed by earlier b279cbb trial)	2026-04-27T06:30:42Z
24ec7d1	4.75	discard	Adaptive threshold blockSize 21->15: regressed 5.25->4.75 (confirms b279cbb blockSize=15 finding)	2026-04-27T07:00:00Z
b68d303	4.50	discard	Bilateral filter 2 passes->1 pass: score regressed 5.25->4.50 (2-pass confirmed needed)	2026-04-27T07:30:00Z
5199402	4.75	discard	close_kernel_size 3->4: middle ground regressed 5.25->4.75 (all sizes >3 hurt)	2026-04-27T07:45:00Z
1496279	0.00	discard	Bilateral sigmaColor 75->100: judge failure (stop hook distraction) — also previously tested at b279cbb with worse result	2026-04-27T07:02:15Z
